{
  "artifact_type": "studio_bundle_manifest",
  "bundle_id": "TODO: bundle-id",
  "bundle_type": "review_package",
  "included_artifacts": [
    {
      "artifact_type": "studio_intake_packet",
      "ref": "examples/studio/scaffolded/studio-intake-packet.scaffolded.json"
    },
    {
      "artifact_type": "proposal_artifact",
      "ref": "examples/studio/scaffolded/proposal-artifact.scaffolded.json"
    },
    {
      "artifact_type": "review_record",
      "ref": "examples/studio/scaffolded/review-record.scaffolded.json"
    },
    {
      "artifact_type": "gate_report",
      "ref": "examples/studio/scaffolded/gate-report.scaffolded.json"
    }
  ],
  "source_packet_ref": "examples/studio/scaffolded/studio-intake-packet.scaffolded.json",
  "review_refs": [
    "examples/studio/scaffolded/review-record.scaffolded.json"
  ],
  "gate_report_refs": [
    "examples/studio/scaffolded/gate-report.scaffolded.json"
  ],
  "consistency_status": "incomplete",
  "intended_next_step": "retain_in_review_layer",
  "proposal_only": true,
  "no_truth_mutation": true,
  "no_runtime_write": true,
  "topic": "TODO: topic",
  "bundle_summary": "TODO: bundle summary"
}
