{
  "artifact_type": "studio_bundle_manifest",
  "bundle_summary": "Keeps proposal-only wording, target nomination, review record, and gate report together as one local reviewable package.",
  "topic": "Proposal-only nomination review package for bounded registry review",
  "no_runtime_write": true,
  "no_truth_mutation": true,
  "proposal_only": true,
  "intended_next_step": "human_registry_review",
  "consistency_status": "consistent",
  "gate_report_refs": [
    "examples/studio/valid/gate-report-pass.valid.json"
  ],
  "review_refs": [
    "examples/studio/valid/review-record-forward.valid.json"
  ],
  "source_packet_ref": "examples/studio/valid/card-review-packet.valid.json",
  "included_artifacts": [
    {
      "artifact_type": "gate_report",
      "ref": "examples/studio/valid/gate-report-pass.valid.json"
    },
    {
      "artifact_type": "card_review_target_artifact",
      "ref": "examples/studio/valid/card-review-target-artifact.valid.json"
    },
    {
      "artifact_type": "studio_intake_packet",
      "ref": "examples/studio/valid/card-review-packet.valid.json"
    },
    {
      "artifact_type": "review_record",
      "ref": "examples/studio/valid/review-record-forward.valid.json"
    },
    {
      "artifact_type": "proposal_artifact",
      "ref": "examples/studio/valid/proposal-artifact.valid.json"
    }
  ],
  "bundle_type": "review_package",
  "bundle_id": "studio-bundle-normalize-001"
}
